new_words,relation
Elizabeth Rogers (May 18 1934 - November 6 2004) was an American actress.,JOB_TITLE
John Sidney Blythe (February 15 1882 - May 29 1942) better known as John Barrymore became famous as a Shakespearean actor lauded for his Hamlet.,JOB_TITLE
John Drew Barrymore also known as John Barrymore Jr. (June 4 1929 - November 29 2004) was an actor one of The Barrymores a family of actors that included his father John Barrymore,JOB_TITLE
Kennedy was given the news that his mother's car had been involved in a fatal accident.,CONTROL
Julius Henry Marx known as Groucho Marx (October 2 1890 - August 19 1977) was an American comedian working both with his siblings the Marx Brothers and on his own.,JOB_TITLE
Jorge Amado de Faria (August 10 1912 - August 6 2001) was a Brazilian writer of the Modernist school.,JOB_TITLE
John William Coltrane (September 23 1926 - July 17 1967) was an American jazz saxophonist and composer.,JOB_TITLE
Catherine of Braganza (25 November 1638 - 30 November 1705) or Catarina de Bragana was the queen consort of King Charles II of England.,JOB_TITLE
Ulysses S. Grant (April 27 1822 - July 23 1885) was the 18th President of the United States (1869 - 1877).,JOB_TITLE
He was a prodigy learning Latin at three Greek at four and writing sermons at seven.,CONTROL
He achieved national fame as a hero of the American Civil War in which he commanded Union forces as a general and as general-in-chief (1864 - 1869).,JOB_TITLE
John Fitzgerald Kennedy (May 29 1917 - November 22 1963) often referred to as Jack Kennedy or JFK was the 35th President of the United States.,JOB_TITLE
John Fitzgerald Kennedy (May 29 1917 - November 22 1963) also known as JFK was the 35th president of the United States of America.,JOB_TITLE
He participated in various commands in the Pacific Theater and earned the rank of lieutenant commanding a patrol torpedo boat or PT boat.,JOB_TITLE
In this he was assisted by his son William.,CONTROL
Ronald Wilson Reagan (February 6 1911 - June 5 2004) was the 40th President of the United States (1981 - 1989) and the 33rd Governor of California (1967 - 1975).,JOB_TITLE
Before entering politics Reagan was also a broadcaster film actor and head of the Screen Actors Guild.,JOB_TITLE
He remained in Hollywood for the duration of the war attaining the rank of captain.,JOB_TITLE
Bush was elected to a second term in the 2004 election.,CONTROL
"""In 1966 he was elected the 33rd Governor of California defeating two-term incumbent Pat Brown;  he was reelected in 1970 defeating Jesse Unruh but chose not to seek a third term.""",JOB_TITLE
Klaas (born August 23 1983 in Rockford Illinois) is an American soccer defensive midfielder who currently plays for the Seattle Sounders of the USL First Division.,JOB_TITLE
Jack Kerouac (March 12 1922 - October 21 1969) was an American novelist writer poet artist and part of the Beat Generation.,JOB_TITLE
"""Bill """"Billy"""" Boucher (b. November 10 1899 in Ottawa Ontario Canada died November 10 1958) was a Canadian professional ice hockey rightwinger who played in the National Hockey League for the Montreal Canadiens Boston Bruins and New York Americans.""",JOB_TITLE
Dr. Benjamin Franklin (January 17 1706 - April 17 1790) was an American publisher journalist author philanthropist abolitionist public servant statesman,JOB_TITLE
In 1775 Franklin became the first United States Postmaster General.,JOB_TITLE
Then he went on to a public grammar school for three years.,CONTROL
Caspar Willard Weinberger (born August 18 1917) is best known as United States Secretary of Defense under President Ronald Reagan from 1981 through 1987 and for his related roles in the Strategic Defense Initiative program (popularly known as Star Wars) and in the Iran-Contra Affair.,JOB_TITLE
Weinberger moved to Washington in January 1970 to become chairman of the Federal Trade Commission subsequently serving as deputy director (1970-72) and director (1972-73) of the Office of Management and Budget and as Secretary of Health Education and Welfare (1973-75).,JOB_TITLE
Mildred Bailey (February 27 1907 - December 12 1951) was a popular American singer during the 1930s.,JOB_TITLE
Recep Tayyip Erdogan (born February 26 1954) became prime minister of Turkey on March 14 2003.,JOB_TITLE
His fan mail jumped to thousands of letters a week.,CONTROL
John W. Duarte(October 2 1919 - December 23 2004) was a British composer and classical guitarist.,JOB_TITLE
The following year he was elected House Minority Whip.,JOB_TITLE
John Fitzgerald Kennedy Jr. often referred to as John F. Kennedy Jr. JFK Jr. or John-John (November 25 1960 - July 16 1999) was an American lawyer journalist and publisher.,NATIONALITY
Sir Henry Edward Bolte (20 May 1908 - 4 January 1990) Australian politician was the longest serving Premier of the state of Victoria.,NATIONALITY
Elizabeth Rogers (May 18 1934 - November 6 2004) was an American actress.,NATIONALITY
Stephen Harriman Long (December 30 1784 - September 4 1864) was a U.S. engineer explorer and military officer.,NATIONALITY
Josiah Wedgwood (July 12 1730 - January 3 1795) was an English potter credited with the industrialisation of the manufacture of pottery.,NATIONALITY
Julius Henry Marx known as Groucho Marx (October 2 1890 - August 19 1977) was an American comedian working both with his siblings the Marx Brothers and on his own.,NATIONALITY
Jorge Amado de Faria (August 10 1912 - August 6 2001) was a Brazilian writer of the Modernist school.,NATIONALITY
John William Coltrane (September 23 1926 - July 17 1967) was an American jazz saxophonist and composer.,NATIONALITY
She succumbed to diabetes in September 2002.,CONTROL
"""Reagan was born in Tampico Illinois the second of two sons to Catholic Irish-American democrat John """"Jack"""" Reagan and Nelle Wilson who was of Scottish and English descent.""",NATIONALITY
Jack Kerouac (March 12 1922 - October 21 1969) was an American novelist writer poet artist and part of the Beat Generation.,NATIONALITY
"""Bill """"Billy"""" Boucher (b. November 10 1899 in Ottawa Ontario Canada died November 10 1958) was a Canadian professional ice hockey rightwinger who played in the National Hockey League for the Montreal Canadiens Boston Bruins and New York Americans.""",NATIONALITY
He served from 1961 until his assassination in 1963.,CONTROL
J. Carrol Naish or Joseph Patrick Carrol Naish (January 21 1897 - January 24 1973) was an American actor born in New York City New York.,NATIONALITY
Dr. Benjamin Franklin (January 17 1706 - April 17 1790) was an American publisher journalist author philanthropist abolitionist public servant statesman,JOB_TITLE
Mildred Bailey (February 27 1907 - December 12 1951) was a popular American singer during the 1930s.,NATIONALITY
John W. Duarte(October 2 1919 - December 23 2004) was a British composer and classical guitarist.,NATIONALITY
Sir Charles Galton Darwin FRS (December 18 1887 - December 13 1962) was the English physicist grandson of Charles Darwin who served as director of the National Physical Laboratory (NPL) during World War II.,NATIONALITY
Friends recall him as disciplined and focused neither drinking nor gambling during a trip to Las Vegas.,CONTROL
Graham Stuart (born October 24 1970) is a former English football (soccer) player who plays as a central-midfielder.,NATIONALITY
George Timothy Clooney (born May 6 1961 in Lexington Kentucky) is an American film and television actor known for his former role in the long-running television drama ER (1994-99).,NATIONALITY
He is a strong supporter of the Democratic Party and is of mostly Irish American heritage although he also has some distant German ancestry.,NATIONALITY
Lawford became an American citizen in 1960 in time to vote for his brother-in-law John F. Kennedy.,NATIONALITY
He and his wife belonged to the Epiphany Catholic Church in Miami for many years.,CONTROL
Stella Dorothea Gibbons (5 January 1902 - 19 December 1989) was an English novelist and poet.,NATIONALITY
Didier Julia (born February 18 1934) is a French politician.,NATIONALITY
John Davison Rockefeller (July 8 1839 - May 23 1937) was an American capitalist most known for his role in the early petroleum industry and the founding of Standard Oil (ExxonMobil is the largest of its descendants).,NATIONALITY
William Seward Burroughs (February 5 1914 - August 2 1997) was an American novelist essayist social critic and spoken word performer.,NATIONALITY
Johann Joachim Quantz (January 30 1697 - July 12 1773) was a German flutist flute maker and composer.,NATIONALITY
In so doing he earned his way into the executive program at the bank.,CONTROL
Kim Basinger (born December 8 1953 in Athens Georgia) is an American film actress of Irish Swedish and 1/8th Cherokee descent.,NATIONALITY
Drew Blythe Barrymore (born February 22 1975 in Culver City California) is an American film and television actress and producer.,NATIONALITY
Johannes (Hans) Wilhelm Geiger (September 30 1882 - September 24 1945) was a German physicist.,NATIONALITY
He spent his time there teaching English.,CONTROL
Irwin Allen Ginsberg (IPA: /?g?nz?b?g/) (June 3 1926 - April 5 1997) was an American Beat poet born in Paterson New Jersey.,NATIONALITY
Adolf Otto Reinhold Windaus (December 25 1876 - June 9 1959) was a significant German chemist.,NATIONALITY
Albert Einstein (March 14 1879 - April 18 1955) was a German-born Jewish theoretical physicist of German Swiss and American citizenship who is widely regarded as the greatest scientist of the 20th century or even of all time ranking alongside the luminaries Newton and Gauss.,NATIONALITY
The same year he renounced his Wuerttemberg citizenship and became stateless.,NATIONALITY
When she became pregnant Barrymore proposed marriage.,CONTROL
The Reverend Martin Luther King Jr. Ph.D. Boston University (January 15 1929 - April 4 1968) was an American Nobel Laureate Baptist minister and African American civil rights activist.,NATIONALITY
Elvis Aron Presley (January 8 1935 - August 16 1977) also known as The King of Rock and Roll (sometimes shortened to The King) was an American singer and actor.,NATIONALITY
David Manners (April 30 1901 - December 23 1998) was a Canadian film actor.,NATIONALITY
Francis Ford Coppola (born April 7 1939 in Detroit Michigan) is an Italian American film director screenwriter vintner magazine publisher and hotelier most renowned for directing the highly regarded Godfather trilogy.,NATIONALITY
Stephen Baldwin (born May 12 1966) is an American actor.,NATIONALITY
He was wearing shoes without socks and died from a toe infection.,CONTROL
Helen Traubel (June 16 1899 - July 28 1972) was an American operatic soprano best known for her Wagnerian roles especially that of Brunnhilde.,NATIONALITY
Jonathan Aitken (born August 30 1942) is a former Conservative minister and convicted perjurer.,POLITICAL_AFFILIATION
In 1960 Dole was elected as a Republican to the United States House of Representatives for the 87th Congress and to three succeeding Congresses spanning from January 3 1961 to January 3 1969.,POLITICAL_AFFILIATION
John Alston Maxton Baron Maxton (born May 5 1936) was a Labour backbench Member of Parliament in the British House of Commons.,POLITICAL_AFFILIATION
Reagan's presidency is regarded as a turning point for the United States Republican Party and the American conservative movement.,POLITICAL_AFFILIATION
Richard Bruce Cheney (born January 30 1941) widely known as Dick Cheney is an American politician and businessman affiliated with the U.S. Republican Party.,POLITICAL_AFFILIATION
As he once joked he was the youngest ex-governor in the nation's history.,CONTROL
Frank Charles Carlucci III (born October 18 1930) was a government official in the United States associated with the Republican Party.,POLITICAL_AFFILIATION
He is a strong supporter of the Democratic Party and is of mostly Irish American heritage although he also has some distant German ancestry.,POLITICAL_AFFILIATION
Henry David Reginald Margesson 1st Viscount Margesson of Rugby (July 26 1890-December 24 1965) was a British Conservative politician most popularly remembered for his tenure as Government Chief Whip in the 1930s.,POLITICAL_AFFILIATION
In retrospect many now view Gore as a helpful factor in the 1992 campaign.,CONTROL
Benjamin Everett Jordan (8 September 1896 - 15 March 1974) was a Democratic U.S. senator from the state of North Carolina between 1958 and 1973.,POLITICAL_AFFILIATION
He is in the Gaullist political family currently a member of the UMP.,POLITICAL_AFFILIATION
The election of fellow-Republican Dwight Eisenhower to the presidency saw Rockefeller appointed first as chair of the President's Advisory Committee on Government Organization and later as an undersecretary in the Department of Health Education and Welfare.,POLITICAL_AFFILIATION
Samuel Adams (5 June 1805 - 27 February 1850) was a Democratic Governor of the State of Arkansas.,POLITICAL_AFFILIATION
He graduated from West Point in 1843 ranking 21st in a class of 39.,CONTROL
Brice Lalonde (born February 10 1946) is a former socialist and Green Party leader in France who ran for President of France in 1981.,POLITICAL_AFFILIATION
Generally regarded as a member of the moderate New Democrat wing of the Democratic Party he headed the centrist Democratic Leadership Council in 1990 and 1991.,POLITICAL_AFFILIATION
Clooney left AMC to run as a Democrat in the 2004 election for a seat in the House of Representatives representing Kentucky's 4th Congressional district.,POLITICAL_AFFILIATION
Rupert John Cornford (27 December 1915 - 28 December 1936) was an English poet and communist.,POLITICAL_AFFILIATION
At the academy he established a reputation as a fearless and expert horseman.,CONTROL
Frank Durward White (June 4 1933 - May 21 2003) was the Republican governor of the U.S. state of Arkansas from 1981 to 1983.,POLITICAL_AFFILIATION
Bush is a lifelong member of the Republican Party and was a businessman in both the oil and professional sports industries.,POLITICAL_AFFILIATION
Bush is a Republican and has Dick Cheney as his Vice President.,POLITICAL_AFFILIATION
He served in the United States Senate as a Republican from Minnesota.,POLITICAL_AFFILIATION
His father a tanner and his mother were born in Pennsylvania.,CONTROL
Lincoln was the first Republican president.,POLITICAL_AFFILIATION
Vasil Petrov Kolarov (July 16 1877 - January 23 1950) was a Bulgarian communist political leader.,POLITICAL_AFFILIATION
Erich Honecker (25 August 1912 - 29 May 1994) was a German Communist politician who led East Germany from 1971 until 1989.,POLITICAL_AFFILIATION
Walter Ulbricht (June 30 1893 - August 1 1973) was a German communist politician.,POLITICAL_AFFILIATION
The contest between the two was bitter although they differed little on issues.,CONTROL
Joseph Forney Johnston (March 23 1843 - August 8 1913) was an American Democratic politician who was the Governor of Alabama from 1896 to 1900.,POLITICAL_AFFILIATION
Hanks is a Democrat and has supported many candidates including Hilary Clinton Diane Feinstein Al Gore and John Kerry.,POLITICAL_AFFILIATION
Arnold Alois Schwarzenegger (born July 30 1947 in Thal Styria Austria) is an Austrian-American actor Republican politician and bodybuilder currently serving as the 38th Governor of California.,POLITICAL_AFFILIATION
James Douglas McKay (June 24 1893 - July 22 1959) born in Portland Oregon was a Republican from Oregon.,POLITICAL_AFFILIATION
He served as the Governor of California from January 2 1939 until January 41943 and was the only Democrat elected to that office between 1898 and 1954.,POLITICAL_AFFILIATION
He was for a short time a commentator opposite Bill Clinton on CBS's 60 Minutes.,CONTROL
Baldwin a liberal Democrat has always had an active interest in politics and is frequently rumored to be a candidate for public office.,POLITICAL_AFFILIATION
Diane Julie Abbott (born September 27 1953 in Paddington London) is a British Labour Member of Parliament for Hackney North and Stoke Newington constituency.,POLITICAL_AFFILIATION
In the Senate he was aligned with the Federalists.,POLITICAL_AFFILIATION
She is a member of the Democratic Party.,POLITICAL_AFFILIATION
Koldewey was a self-trained classical era archaeological historian.,CONTROL
"""John Ellis """"Jeb"""" Bush (born February 11 1953) a Republican is the forty-third and current Governor of Florida.""",POLITICAL_AFFILIATION
Rather than retire Adams would go on to win election as a Democratic-Republican to the House of Representatives beginning with the 22nd Congress serving from March 41831 until his death.,POLITICAL_AFFILIATION
Lyman Enos Knapp (November 5 1837 - October 9 1904) was an American Republican politician who was the Governor of the District of Alaska from 1889 to 1893.,POLITICAL_AFFILIATION
Henry Bolte was born in Ballarat the son of a publican of German descent (the family name was pronounced Bol-tee).He was to spend the first 24 years of his life (apart from three years at boarding school) in the small western district town of Skipton.,VISITED
After working in various manual jobs he married Edith Elder in 1934 and bought a small farm at Bamganie near Meredith where he lived for the rest of his life running sheep and cattle.,VISITED
He was noted for his involvement in conservation and the protection of wildlife.,CONTROL
He was born in Groton England as the son of John Winthrop the founding governor of the Massachusetts Bay Colony.,VISITED
During the Great Depression which hit all of Kansas very hard the Doles moved into the basement of their home and rented out the rest of their house.,VISITED
Dole has worked part-time for a Washington DC law firm and engaged in a career of writing consulting public speaking and television appearances.,VISITED
"""As an Army officer he led a pioneering scientific expedition throughout a large area of the Great Plains which he famously described as the """"Great American Desert.""""""",VISITED
His work dealt largely with the poor urban black and mulatto communities of Bahia.,VISITED
Laurance and Mary had three daughters and a son.,CONTROL
Jorge Amado went to Rio de Janeiro in 1931 and in the next year started to study law in the University of Rio de Janeiro.,VISITED
Marvin graduated from Woodberry Forest School in 1975 and spent most summers and holidays at the sprawling family estate the Bush Compound.,VISITED
He was a director of the Sterling Virginia company Securacom also known as Stratesec from 1993 until fiscal year 2000.,VISITED
Coltrane moved to Philadelphia Pennsylvania in June 1943.,VISITED
Bush and his former wife Sharon Smith were married for 23 years.,CONTROL
At the age of 17 and having barely passed West Point's height requirement for entrance Grant received a cadetship to the United States Military Academy at West Point New York through his U.S. Congressman Thomas L. Hamer.,VISITED
In the fall of 1823 they moved to the village of Georgetown in Brown County Ohio where Grant spent most of his time until he was 17.,VISITED
In 1920 after years of moving from town to town the family settled in Dixon Illinois.,VISITED
She is the youngest daughter of their household eternally a baby.,CONTROL
"""His nationally televised speech """"A Time for Choosing"""" electrified conservatives;  soon after several top Republican contributors visited Reagan at his home in Pacific Palisades California urging him to seek the governorship in 1966.""",VISITED
In 1928 Reagan entered Eureka College in Eureka Illinois majoring in economics and sociology and graduating in 1932.,VISITED
In between his sea voyages Kerouac stayed in New York with friends from Fordham.,VISITED
He is the heir to several Forbes family offshore trusts.,CONTROL
Rodgers shortly fled debt and prosecution by going to Barbados leaving Deborah behind.,VISITED
At the age of 17 Franklin ran away to Philadelphia seeking a new start in a new city.,VISITED
After a few months while working in a printing house Franklin was induced by Pennsylvania Governor Sir William Keith to go to London ostensibly to acquire the equipment necessary for establishing another newspaper in Philadelphia.,VISITED
Cannon County Tennessee is named in his honor.,CONTROL
Nicholas Gilman Jr. (August 3 1755 - May 2 1814) was a soldier in the Continental Army during the American Revolutionary War a delegate to the Continental Congress and a signer of the U.S. Constitution representing New Hampshire.,VISITED
Details of Cheney's second Wyoming arrest in July 1963 have fallen victim to time and record destruction practices.,VISITED
Cheney grew up in Casper Wyoming and met his high-school sweetheart and future wife Lynne Vincent at age fourteen.,VISITED
Carlucci became Ambassador to Portugal and served in this position from 1974 until 1977.,VISITED
His father changed the family name from Levy when he was a child.,CONTROL
In 1961 he participated in a CIA mission to Congo in which he used his athletic ability to rescue US citizens from mobs but was also reportedly involved in the assassination of Prime Minister Patrice Lumumba.,VISITED
Clooney got his start in Los Angeles a young college dropout from Kentucky who spent a good chunk of his struggling actor years riding to auditions on a bicycle.,VISITED
"""Peter Sydney Lawford (September 7 1923 - December 24 1984) was a Hollywood actor and member of Frank Sinatra's """"Rat Pack more noted for his off-screen activities as a celebrity than for his acting.""",VISITED
"""He maintained homes in Long Island New York and Greenwich Connecticut; the family compound at Kennebunkport Maine; a 10000 acre (40 km˝) plantation in South Carolina; and an island retreat in Florida.""",VISITED
He received training in intelligence at Verdun and was briefly assigned to a staff of French officers.,VISITED
He is considered the founder of modern Biblical criticism.,CONTROL
The Bushes moved to Columbus Ohio in 1923 where Bush worked for the Hupp Products Company where his business efforts generally failed.,VISITED
He left in November 1923 to become president of sales for Stedman Products of South Braintree Massachusetts.,VISITED
In 1925 he joined the United States Rubber Company (based in New York City) as manager of the foreign division and moved to Greenwich Connecticut.,VISITED
After his discharge in 1919 Bush went to work for the Simmons Hardware Company in St. Louis Missouri.,VISITED
Clooney was Ferrer's third wife.,CONTROL
In 1879 he left home for the nearby city of Detroit to work as an apprentice machinist first with James F. Flower & Bros. and later with the Detroit Dry Dock Co.,VISITED
"""He did not complete his degree choosing instead to seek his fortune in the United States of America;  but the First World War intervened.""",VISITED
"""He received his """"boot"""" training at Paris Island South Carolina.""",VISITED
His parents were both members of the Nazi party.,CONTROL
After he graduated basic training he was sent to Camp Lejuene in North Carolina where he underwent advanced training before being sent to Korea.,VISITED
He moved to San Juan where he started to work for the Texas Company as a file clerk.,VISITED
He married Carolyn Bessette in 1996.,WIFE
Ferrer had previously been married to Uta Hagen (1938-1948) by whom he had a daughter and actress Phyllis Hill (1948-1953).,WIFE
At the time of his death Ferrer was married to Stella Magee whom he married in 1992.,WIFE
He married his second wife Elizabeth Harris in June 2003.,WIFE
Dole has been married to Senator Elizabeth Dole nee Hanford of North Carolina since 1975.,WIFE
The couple have four children: daughters Katherine and Christina and sons Patrick and Christopher.,CONTROL
Barrymore married Katherine Corri Harris (1891-1927) an actress who starred in the 1918 film The House of Mirth on September 1 1910 and divorced in 1916.,WIFE
"""He married Blanche Marie Louise Oelrichs (1890-1950) a New York mining heiress who wrote under the pseudonym """"Michael Strange on August 5 1920 and divorced her in 1925.""",WIFE
"""His fourth wife was Elaine Barrie (nee Elaine Jacobs 1916-2003) an actress;  they married on November 9 1936 and divorced in 1940.""",WIFE
Grant married Julia Boggs Dent (1826 - 1902) on August 22 1848.,WIFE
He was given just his grandfather's first and last name and was not given any middle name.,CONTROL
Kennedy married his second wife Jacqueline Bouvier on September 12 1953.,WIFE
Reagan later married actress Jane Wyman in 1940.,WIFE
Reagan remarried in 1952 to actress Nancy Davis.,WIFE
Cheney grew up in Casper Wyoming and met his high-school sweetheart and future wife Lynne Vincent at age fourteen.,WIFE
In 1964 he married Lynne Vincent.,WIFE
Therefore from a very young age Lincoln was exposed to anti-slavery sentiment.,CONTROL
Einstein married Mileva Maria on January 6 1903.,WIFE
King married Coretta Scott on June 18 1953.,WIFE
"""His wife former first lady Hillary Rodham Clinton is currently the junior U.S. Senator from New York.""",WIFE
"""After Oxford Clinton received a Juris Doctor (J.D.) degree from Yale Law School where he met classmate Hillary Rodham whom he married in 1975.""",WIFE
In a valley of the Rolling Fork River this was some of the best farmland in the area.,CONTROL
The most important item on Clinton's legislative agenda however was a complex health care reform plan the result of a taskforce headed by Hillary Clinton aimed at achieving universal coverage.,WIFE
On 29 January 1839 Darwin married his cousin Emma Wedgwood at Maer in an Anglican ceremony arranged to also suit the Unitarians.,WIFE
Shire is currently married to actress Didi Conn.,WIFE
These events soon led to the American Civil War.,CONTROL
He was married to actress Talia Shire whose brother Francis Ford Coppola offered him his big break scoring The Conversation in 1974.,WIFE
Together Professor J. Laurence Laughlin and Roosevelt's girlfriend and future wife Alice Hathaway Lee convinced Roosevelt to drop natural history in favor of politics.,WIFE
