new_words,relation
"""During this time he was prescribed Ritalin for hyperactivity;  years later his wife Courtney Love blamed Ritalin for his addiction to heroin.""",WIFE
Two years later he married Laura Welch a librarian originally from Midland.,WIFE
Though earning mediocre grades he made many lasting friendships.,CONTROL
Bush is very close to his wife Laura his father George H. W. Bush and mother Barbara Bush.,WIFE
He married his first wife Joyce Halverson in 1951.,WIFE
He later married Jean Forsyth Clyde in 1973 with whom he was married for the rest of his life.,WIFE
He is married to singer Chynna Phillips.,WIFE
After the media caught wind of the comment he apologized.,CONTROL
He purchased a commission in the army but sold it again without serving and in August 1827 married in opposition to his mother's wishes Rosina Doyle Wheeler (1802-1882).,WIFE
On November 41842 Lincoln married Mary Todd.,WIFE
Honecker married Margot Feist in 1953 and remained married until his death.,WIFE
He was married to Harriet Fay.,WIFE
He was married to Grace Coolidge and had 2 children: John (born 6 September 1906 - died 2000) and Calvin Jr. (born 13 April - died 1924).,WIFE
He was married with HRH Princess Olga of Greece and Denmark in 1923.,WIFE
He has a son Weston Coppola Cage (born 1990) by model Kristina Fulton.,WIFE
On April 8 1995 he married actress Patricia Arquette.,WIFE
On August 10 2002 he married Lisa Marie Presley and filed for divorce less than four months later.,WIFE